Article,Vedette,Type vedette,Candidat,INSEE,Définition
DT37-19193,"Pain-Béni (le lieu du),",,Grande-Audianière,,"commune de Monnaie, près du chemin de la Grande-Audianière à la Boissière."
DT37-19193,"Pain-Béni (le lieu du),",,Boissière,,"commune de Monnaie, près du chemin de la Grande-Audianière à la Boissière."
DT37-19204,"Painviel,",ancien fief,Poitou,,"ancien fief, paroisse d’Oiré, en Poitou."
DT37-19211,"Palais (le lieu du),",,Maillé,,"commune de Maillé-Lailler, près du chemin du village des Champs, à Maillé."
DT37-19220,"Palis (le lieu des),",,Vieille-Lande,,"commune de Cussay, près du chemin de la Cigogne à la Vieille-Lande."
DT37-19221,"Palis (le lieu des),",,Roches,,"commune de Noyant, près du chemin de Pouzay aux Roches."
DT37-19319,"Parc (le lieu du),",,landes du Ruchard,,"dans les landes du Ruchard, commune d’Avon."
DT37-19367,"Parterre (le lieu du),",,bourg de Candes,,dans le bourg de Candes.
DT37-19374,"Pas-Biton (le lieu de),",,Basse-Cour,,"commune de Louans, près du chemin de la Basse-Cour à Varnelle."
DT37-19374,"Pas-Biton (le lieu de),",,Varnelle,,"commune de Louans, près du chemin de la Basse-Cour à Varnelle."
DT37-19420,"Passissement (le lieu de),",,Fuie-Poitevin,,"commune de Chezelles, près du chemin de la Fuie-Poitevin au Gué."
DT37-19420,"Passissement (le lieu de),",,Gué,,"commune de Chezelles, près du chemin de la Fuie-Poitevin au Gué."
DT37-19422,"Passoir (le lieu du),",,Marcilly,,"commune de Marcilly-sur-Vienne, près du chemin de Rilly à Marcilly."
DT37-19579,"Peigné (la fontaine de),",,Marigny,,"commune de Marigny, près du chemin de Marigny aux Ormes."
DT37-19579,"Peigné (la fontaine de),",,Ormes,,"commune de Marigny, près du chemin de Marigny aux Ormes."
DT37-19628,"Pelouses (le lieu des),",,Dauconnay,,"commune de Marçay, près du chemin de Couesme à Dauconnay."
DT37-19655,"Pennières (le lieu des),",,Haye,,"commune de Boussay, près de la route de la Haye à Preuilly."
DT37-19659,"Pensée-du-Roi (le lieu de la),",,Miltière,,"commune de Montlouis, près du chemin de la Miltière à Azay."
DT37-19659,"Pensée-du-Roi (le lieu de la),",,Azay,,"commune de Montlouis, près du chemin de la Miltière à Azay."
DT37-19660,"Penserots (le lieu des),",,Rouget,,"commune du Grand-Pressigny, près du chemin du Rouget à la Croix-des-Marquets."
DT37-19660,"Penserots (le lieu des),",,Croix-des-Marquets,,"commune du Grand-Pressigny, près du chemin du Rouget à la Croix-des-Marquets."
DT37-19687,"Perche (la fosse de la),",,landes du Ruchard,,"dans les landes du Ruchard, commune d’Avon."
DT37-19689,"Perche (bois de la),",,Chartre,,"commune d’Épeigné-sur-Dême, près du chemin de la Chartre à Tours."
DT37-19699,"Perdereau (le lieu de),",,Bourdonnière,,"commune de Rochecorbon, près du chemin de la Bourdonnière à la Vinettrie."
DT37-19699,"Perdereau (le lieu de),",,Vinettrie,,"commune de Rochecorbon, près du chemin de la Bourdonnière à la Vinettrie."
DT37-19717,"Perioux (le bois),",,Giberdière,,"commune de Vallères, près du chemin de la Giberdière à la Cossonnière."
DT37-19717,"Perioux (le bois),",,Cossonnière,,"commune de Vallères, près du chemin de la Giberdière à la Cossonnière."
DT37-19738,"Perray (le Grand-),",,Anjou,,"paroisse de la Bruère, en Anjou."
DT37-19793,"Perrés (le lieu des),",,Carroi-de-Montifault,,"commune de Ligré, près du chemin du Carroi-de-Montifault à la Galvauderie."
DT37-19793,"Perrés (le lieu des),",,Galvauderie,,"commune de Ligré, près du chemin du Carroi-de-Montifault à la Galvauderie."
DT37-19799,"Perret-de-l’Étang (le lieu du),",,Princé,,"commune d’Auzouer, près du chemin d’Auzouer à Princé."
DT37-19800,"Perrets (le lieu des),",,Tremble,,"commune de Civray-sur-Cher, près du chemin du Tremble à Chenonceau."
DT37-19805,"Perrichets (le lieu des),",,bourg de Saunay,,dans le bourg de Saunay.
DT37-19831,"Perrières (les),",hameau,Poitou,,"paroisse de Coussay-les-Bois, en Poitou."
DT37-19863,"Perron (hôtel du),",,cloître Saint-Martin,,"à Tours, dans le cloître Saint-Martin."
DT37-19885,"Perruche-du-Croulay (le lieu de la),",,Vacherie,,"commune de Panzoult, près du chemin de la Vacherie au Croulay."
DT37-19885,"Perruche-du-Croulay (le lieu de la),",,Croulay,,"commune de Panzoult, près du chemin de la Vacherie au Croulay."
DT37-19930,"Pesnière (la croix de la),",,Marchais-Ruisseau,,"commune de Sainte-Maure, près du chemin de Sainte-Maure à Marchais-Ruisseau, sur les limites de la commune de Sepmes."
DT37-19942,"Pestiférés (le lieu des),",,Mans,,"commune de Neuillé-Pont-Pierre, près de la route de Tours au Mans."
DT37-19944,"Pet-de-Fourche (le lieu du),",,Celle,,"commune de la Celle-Saint-Avent, près du chemin de la Haye-Descartes à la Celle."
DT37-19981,"Petit-Bonheur (le),",ferme,Ripault,,"ferme, commune de Veigné, près du chemin de Tours au Ripault."
DT37-19996,"Petit-Étang (le),",,Haye,,"commune de Barrou, près du chemin de la Haye à la Gaudière."
DT37-19996,"Petit-Étang (le),",,Gaudière,,"commune de Barrou, près du chemin de la Haye à la Gaudière."
DT37-20001,"Petit-Gué (le),",,Anjou,,"paroisse d’Auverse, en Anjou."
DT37-20012,"Petit-Marchais (le lieu du),",,landes du Ruchard,,"dans les landes du Ruchard, commune d’Avon."
DT37-20033,"Petit-Phard (le lieu du),",,Bordeaux,,"commune de Sorigny, près de la route de Bordeaux à Paris."
DT37-20033,"Petit-Phard (le lieu du),",,Paris,,"commune de Sorigny, près de la route de Bordeaux à Paris."
DT37-20034,"Petit-Pied (le),",,bourg de Mosnes,,dans le bourg de Mosnes.
DT37-20080,"Petites-Croix (le lieux des),",,Effes,,"commune de Saint-Flovier, près du chemin de Saint-Flovier aux Effes."
DT37-20124,"Peu (le lieu du),",,Bec-des-Deux-Eaux,,"commune de Nouâtre, près du chemin du Bec-des-Deux-Eaux à Port-de-Piles."
DT37-20127,"Peu-Bazin (le lieu du),",,village du Bois,,"près du village du Bois, commune de Rilly."
DT37-20128,"Peu-Blanc (le lieu du),",,Saint-Gilles,,"commune de Braslou, près du chemin de Saint-Gilles à Chinon."
DT37-20136,"Peu-d’Olivet (le lieu du),",,Closeaux,,"commune de Chinon, près du chemin des Closeaux à Neuville."
DT37-20138,"Peu-Meunier (le lieu du),",,Faye,,"commune de Braslou, près du chemin de Braslou à Faye."
DT37-20159,"Peux (le lieu des),",,Chevrie,,"commune de Villaines, près du chemin de la Chevrie à Villaines."
DT37-20283,"Pied-Long (le lieu de),",,Marigny,,"commune de Pussigny, près du chemin de Pussigny à Marigny."
DT37-20313,"Pierre (la croix de),",,Noyers,,"commune de Nouâtre, près du chemin de Noyers à Sainte-Maure."
DT37-20316,"Pierre (la croix de),",,Tournon,,"commune de Saint-Pierre-de-Tournon, près du chemin de Tournon à Preuilly."
DT37-20320,"Pierre-à-Bidault (le lieu de la),",,Saint-Laurent,,"commune de Monnaie, près du chemin de Monnaie à Saint-Laurent."
DT37-20326,"Pierre-Blanche (le lieu de la),",,Parçay,,"commune de Parçay-Meslay, près du chemin de Parçay à Meslay."
DT37-20326,"Pierre-Blanche (le lieu de la),",,Meslay,,"commune de Parçay-Meslay, près du chemin de Parçay à Meslay."
DT37-20327,"Pierre-Blanche (le lieu de la),",,Montgauger,,"commune de Saint-Épain, près du chemin de Montgauger aux Touches."
DT37-20327,"Pierre-Blanche (le lieu de la),",,Touches,,"commune de Saint-Épain, près du chemin de Montgauger aux Touches."
DT37-20332,"Pierre-Couverte (le lieu de la),",,Beaumont,,"commune de Chanceaux-sur-Choisille, près de la route de Beaumont à Tours."
DT37-20333,"Pierre-Couverte (fontaine de la),",,Azay,,"commune de Dolus, près du chemin de Dolus à Azay."
DT37-20339,"Pierre-du-Faon (l’hôtel de la),",,bourg de Nouâtre,,dans le bourg de Nouâtre.
DT37-20348,"Pierre-du-Lavoir (le lieu de la),",,Chartre,,"commune d’Épeigné-sur-Dême, près du chemin de la Chartre à Tours."
DT37-20354,"Pierre-Levée (le lieu de),",,Hys,,"commune du Liège, près du chemin d’Hys au Liege."
DT37-20355,"Pierre-Levée (le lieu de),",,Haye,,"commune de Maillé, près du chemin de Chinon à la Haye."
DT37-20357,"Pierre-Levée (le lieu de),",,chemin du Mur-Duval,,"près de Doux, commune de Pussigny, entre le chemin du Mur-Duval et celui de Jaulnay."
DT37-20358,"Pierre-Levée (le lieu de),",,Hys,,"commune de Saint-Quentin, près du chemin de Tavant à Hys."
DT37-20360,"Pierre-Martinet (le lieu de),",,paroisse du Louroux,,paroisse du Louroux.
DT37-20364,"Pierre-Percée (le lieu de la),",,Bullotière,,"commune du Louroux, près du chemin de la Bullotière à la Gitonnière."
DT37-20364,"Pierre-Percée (le lieu de la),",,Gitonnière,,"commune du Louroux, près du chemin de la Bullotière à la Gitonnière."
DT37-20368,"Pierre-Plate (le lieu de),",,Port-Boulet,,"commune de Bourgueil, près du chemin de Port-Boulet à Bourgueil."
DT37-20380,"Pierres-Cassées (le lieu des),",,Villeloin,,"commune de Villeloin, près du chemin de Villeloin à la Chapelle-Saint-Hippolyte."
DT37-20384,"Pierres-Marteau (le lieu des),",,Pont-de-Gruteau,,"commune d’Avon, près du chemin du Pont-de-Gruteau aux landes du Ruchard."
DT37-20384,"Pierres-Marteau (le lieu des),",,landes du Ruchard,,"commune d’Avon, près du chemin du Pont-de-Gruteau aux landes du Ruchard."
DT37-20414,"Pignonneries (le lieu des),",,Étableaux,,"commune du Petit-Pressigny, près du chemin d’Étableaux à Azay."
DT37-20414,"Pignonneries (le lieu des),",,Azay,,"commune du Petit-Pressigny, près du chemin d’Étableaux à Azay."
DT37-20420,"Piharnière (la),",,Blésois,,"paroisse de Prunay, en Blésois."
DT37-20434,"Pilets (le lieu des),",,Pouzière,,"commune de Thilouze, près du chemin de Thilouze à la Pouzière."
DT37-20459,"Pilori-de-la-Taille (le lieu du),",,Châtillon,,"commune de Charnizay, près du chemin de Preuilly à Châtillon."
DT37-20475,"Pin (la croix du),",,Celle-Guenand,,"commune de la Celle-Guenand, près du chemin de la Celle-Guenand au Grand-Pressigny."
DT37-20475,"Pin (la croix du),",,Grand-Pressigny,,"commune de la Celle-Guenand, près du chemin de la Celle-Guenand au Grand-Pressigny."
DT37-20487,"Pin (le),",ferme,Poitou,,"paroisse de Méré, en Poitou."
DT37-20491,"Pin (le),",,Poitou,,"paroisse de Poizay-le-Joly, en Poitou."
DT37-20518,"Pinassières (le lieu des),",,Ray,,"commune du Petit-Pressigny, près du chemin de Ray à Preuilly."
DT37-20525,"Pinaudières (le lieu des),",,Celle,,"commune de Preuilly, près du chemin de la Celle à Bossay."
DT37-20541,"Pineau,",,faubourg d’Azay-le-Rideau,,faubourg d’Azay-le-Rideau.
DT37-20567,"Pinorbeau (le lieu de),",,Beauregard,,"commune de Draché, près du chemin de Beauregard à la Rerais."
DT37-20567,"Pinorbeau (le lieu de),",,Rerais,,"commune de Draché, près du chemin de Beauregard à la Rerais."
DT37-20570,"Pinotière (le lieu de la),",,Haye,,"commune de Boussay, près du chemin de la Haye à Preuilly."
DT37-20642,"Pisseloup (bois de),",,Seigre,,"commune de la Celle-Saint-Avent, près du chemin de Seigre à la Bourellière."
DT37-20642,"Pisseloup (bois de),",,Bourellière,,"commune de la Celle-Saint-Avent, près du chemin de Seigre à la Bourellière."
DT37-20671,"Pitouet (le lieu de),",,Morinière,,"commune de Saint-Épain, près du chemin de la Morinière aux Berthelonnières."
DT37-20671,"Pitouet (le lieu de),",,Berthelonnières,,"commune de Saint-Épain, près du chemin de la Morinière aux Berthelonnières."
DT37-20686,"Place (la fontaine de la),",,limites de Channay et de Saint-Laurent-de-Lin,,sur les limites de Channay et de Saint-Laurent-de-Lin.
DT37-20698,"Place-des-Jaux (le lieu de la),",,Grand-Pressigny,,"commune de Neuilly-le-Brignon, près du chemin du Grand-Pressigny à Preuilly."
DT37-20716,"Places (le lieu des),",,Tournon,,"commune d’Yzeures, près du chemin d’Yzeures à Tournon."
DT37-20754,"Planche (le lieu de la),",,étang du Grand-Clos,,"commune de la Chapelle-Blanche, près de l’étang du Grand-Clos."
DT37-20757,"Planche (le lieu de la),",,paroisse du Grand-Pressigny,,paroisse du Grand-Pressigny.
DT37-20816,"Plantes-de-Béchenoix (le lieu des),",,Béchenoix,,"commune de Theneuil, près du chemin de Theneuil à Béchenoix."
DT37-20823,"Plassay (le lieu de),",,Vallée-du-Vau,,"commune de Vallères, près du chemin de la Vallée-du-Vau au Houssard."
DT37-20823,"Plassay (le lieu de),",,Houssard,,"commune de Vallères, près du chemin de la Vallée-du-Vau au Houssard."
DT37-20841,"Plault (la croix),",,Moulin-Girault,,"commune de Charnizay, près du chemin de Charnizay au Moulin-Girault."
DT37-20847,"Plenterne (le lieu de la),",,Pizoir,,"commune de Rochecorbon, près du chemin du Pizoir à Monnaie."
DT37-20894,"Plessis (le lieu du),",,Vernoil,,"commune de Saint-Nicolas-de-Bourgueil, près du chemin de Vernoil à Bourgueil."
DT37-20912,"Plessis-Buisson (le),",,Anjou,,"paroisse de Broc, en Anjou."
DT37-20921,"Plessis-Maulaville (le),",fief,ponts d’Amboise,,fief situé au bout des ponts d’Amboise.
DT37-20934,"Plonier (le lieu de),",,Petite-Barre,,"commune de Druye, près du chemin de la Petite-Barre à Bois-Mignié."
DT37-20934,"Plonier (le lieu de),",,Bois-Mignié,,"commune de Druye, près du chemin de la Petite-Barre à Bois-Mignié."
DT37-20941,"Plousière (le lieu de),",,Coutureau,,"commune de Lémeré, près du chemin de Coutureau à la Daboiserie."
DT37-20941,"Plousière (le lieu de),",,Daboiserie,,"commune de Lémeré, près du chemin de Coutureau à la Daboiserie."
DT37-20949,"Pochete (fontaine de la),",,bois de la Vauderne,,"dans les bois de la Vauderne, commune des Essarts."
DT37-20962,"Poibon (le lieu de),",,Celle,,"commune de la Celle-Guenand, près du chemin de la Celle au Grand-Pressigny."
DT37-20962,"Poibon (le lieu de),",,Grand-Pressigny,,"commune de la Celle-Guenand, près du chemin de la Celle au Grand-Pressigny."
DT37-20972,"Point (le lieu de),",,Pinotière,,"commune de Saint-Pierre-de-Tournon, près du chemin de la Pinotière à Tournon."
DT37-20972,"Point (le lieu de),",,Tournon,,"commune de Saint-Pierre-de-Tournon, près du chemin de la Pinotière à Tournon."
DT37-20986,"Pointe-de-Bougésie (le lieu de la),",,Bréchottière,,"commune de Louans, près du chemin de Sainte-Maure à la Bréchottière."
DT37-20990,"Pointe-de-Raymond (le lieu de la),",,Manne,,"commune de Crouzilles, près du chemin de Manne à Richelieu."
DT37-20994,"Pointes (le lieu des),",,Marigny,,"commune de Ports, près du chemin de Marigny à Marcilly."
DT37-20994,"Pointes (le lieu des),",,Marcilly,,"commune de Ports, près du chemin de Marigny à Marcilly."
DT37-21011,"Poirières (la maison des),",,bourg de Vallières,,"dans le bourg de Vallières, commune de Fondettes."
DT37-21016,"Poisson (le lieu du),",,Chaîne-Soulière,,"commune de Manthelan, près du chemin de Manthelan à la Chaîne-Soulière."
DT37-21018,"Poissonnerie (le lieu de la),",,landes du Ruchard,,"dans les landes du Ruchard, commune de Cravant."
DT37-21040,"Poitevins (la fontaine des),",,Villesetier,,"commune de Rochecorbon, près du chemin de Rochecorbon à Villesetier."
DT37-21049,"Poizay-le-Joly,",,diocèse de Poitiers,,"paroisse de l’archiprêtré de Châtellerault, diocèse de Poitiers."
DT37-21097,"Ponay (forteresse de),",,Berry,,en Berry.
DT37-21099,"Ponceau (le lieu du),",,Briançon,,"commune de Cravant, près du chemin de Briançon à la Châtellerie."
DT37-21099,"Ponceau (le lieu du),",,Châtellerie,,"commune de Cravant, près du chemin de Briançon à la Châtellerie."
DT37-21153,"Pont-Berri (le lieu de),",,Braye,,"commune de Braslou, près du chemin de Braye à la Babinière."
DT37-21153,"Pont-Berri (le lieu de),",,Babinière,,"commune de Braslou, près du chemin de Braye à la Babinière."
DT37-21179,"Pont-de-la-Clau (le lieu du),",,faubourg Saint-Nicolas,,"près de la Claise, commune de Preuilly, près du faubourg Saint-Nicolas."
DT37-21196,"Ponteaux (le lieu des),",,Bouteries,,"commune de la Celle-Guenand, près du chemin des Bouteries à Sainte-Julitte."
DT37-21196,"Ponteaux (le lieu des),",,Sainte-Julitte,,"commune de la Celle-Guenand, près du chemin des Bouteries à Sainte-Julitte."
DT37-21197,Pontelini,,paroisses de Saint-Cyr et de Saint-Symphorien,,située dans les paroisses de Saint-Cyr et de Saint-Symphorien.
DT37-21216,"Pontillon (le lieu de),",,bourg de Charnizay,,près du bourg de Charnizay.
DT37-21223,"Pont-Levé (le lieu de),",,bourg de Verneuil-sur-Indre,,près du bourg de Verneuil-sur-Indre.
DT37-21345,"Port-de-Piles,",commune,département de la Vienne,,"commune du département de la Vienne, sur la Creuse."
DT37-21347,"Port-de-Rignier (île du),",,en face de Luynes,,"dans la Loire, en face de Luynes."
DT37-21381,"Porte-au-Clerc (le lieu de la),",,Neuvy,,"commune de Louestault, près du chemin de Neuvy à Chateaurenault."
DT37-21462,"Poteau-de-Mer (le),",ferme,Sammarçolle,,"ferme, commune de Marçay, près du chemin de Marcay à Sammarçolle."
DT37-21465,"Poteau-Rouge (le lieu du),",,Chavenay,,"près du ruisseau de Chavenay, commune de Seuilly."
DT37-21467,"Potence (le lieu de la),",,Haye,,"commune de Chambon, près du chemin de la Haye à Preuilly."
DT37-21512,"Pouant (le lieu de),",,Noyers,,"commune de Nouâtre, près du chemin de Noyers à Port-de-Piles."
DT37-21515,"Poué (le lieu de),",,Baratière,,"commune d’Yzeures, près du chemin de Baratière à Thou."
DT37-21515,"Poué (le lieu de),",,Thou,,"commune d’Yzeures, près du chemin de Baratière à Thou."
DT37-21561,"Poulinière (le fief de la),",,paroisses de Saint-Laurent de Langeais et de Saint-Symphorien-des-Ponceaux,,s’étendait dans les paroisses de Saint-Laurent de Langeais et de Saint-Symphorien-des-Ponceaux.
DT37-21575,"Pouparts (le lieu des),",,Ré,,"commune de Louans, près du chemin de Louans à Ré."
DT37-21601,"Pouvalinière (le lieu de la),",,bourg de Saunay,,dans le bourg de Saunay.
DT37-21617,"Prateaux (le lieu des),",,paroisse du Boulay,,paroisse du Boulay.
DT37-21630,"Pré (le moulin du),",,étang du Louroux,,"sur le ruisseau de l’étang du Louroux, commune du Louroux."
DT37-21636,"Préau (le lieu de),",,Saumur,,"commune de Thizay, près de la route de Saumur à Chinon."
DT37-21638,"Préaux (la croix des),",,Martray,,"commune de Marigny, près du chemin de Martray à Marmande."
DT37-21638,"Préaux (la croix des),",,Marmande,,"commune de Marigny, près du chemin de Martray à Marmande."
DT37-21660,"Pré-Gallet (le lieu de),",,Paris,,"commune de Monthodon, près de l’ancienne route de Paris à Bordeaux."
DT37-21660,"Pré-Gallet (le lieu de),",,Bordeaux,,"commune de Monthodon, près de l’ancienne route de Paris à Bordeaux."
DT37-21666,"Préhudeau (île de),",,paroisses de Rochecorbon et de Saint-Georges,,"dans la Loire, paroisses de Rochecorbon et de Saint-Georges."
DT37-21677,"Prenats (le lieu des),",,Braye,,"commune de Braslou, près du chemin de Braye à la Babinière."
DT37-21677,"Prenats (le lieu des),",,Babinière,,"commune de Braslou, près du chemin de Braye à la Babinière."
DT37-21695,"Prés-de-Bourgjolly (le lieu des),",,Paris,,"commune de Saint-Épain, près de la route de Paris à Bordeaux."
DT37-21695,"Prés-de-Bourgjolly (le lieu des),",,Bordeaux,,"commune de Saint-Épain, près de la route de Paris à Bordeaux."
DT37-21696,"Prés-de-l’Abbesse (le lieu de),",,Bordeaux,,"commune de Saint-Épain, près de la route de Bordeaux à Paris."
DT37-21696,"Prés-de-l’Abbesse (le lieu de),",,Paris,,"commune de Saint-Épain, près de la route de Bordeaux à Paris."
DT37-21756,"Pressoir-de-Pierre (le lieu du),",,bourg de Bueil,,dans le bourg de Bueil.
DT37-21760,"Pressoir-l’Andouille (le lieu du),",,Fontevrault,,"commune de Candes, près de la route de Fontevrault à Saumur."
DT37-21760,"Pressoir-l’Andouille (le lieu du),",,Saumur,,"commune de Candes, près de la route de Fontevrault à Saumur."
DT37-21780,"Preuilly (le fief),",,Poitou,,en Poitou.
DT37-21786,"Prévôté (le lieu de la),",,limites de Montbazon,,"commune de Monts, sur les limites de Montbazon."
DT37-21795,"Prieuré (la croix du),",,Petit-Bergeresse,,"commune d’Azay-sur-Indre, sur le chemin du Petit-Bergeresse à Azay."
DT37-21795,"Prieuré (la croix du),",,Azay,,"commune d’Azay-sur-Indre, sur le chemin du Petit-Bergeresse à Azay."
DT37-21836,"Priollesses (le lieu des),",,Azay,,"commune de la Chapelle-aux-Naux, près du chemin de Langeais à Azay."
DT37-21869,"Proutière (le lieu de la),",,Montigny,,"commune de Saché, près du chemin de Montigny au Chemin-Ferré."
DT37-21869,"Proutière (le lieu de la),",,Chemin-Ferré,,"commune de Saché, près du chemin de Montigny au Chemin-Ferré."
DT37-21889,"Prunetière (le lieu de la),",,Couronnière,,"commune de Saint-Épain, près du chemin de la Couronnière à Villeperdue."
DT37-21894,"Psé (fontaine de),",,Bec-des-Deux-Eaux,,"commune de Marigny, près du chemin de Jaulnay au Bec-des-Deux-Eaux."
DT37-21919,"Puiset (la seigneurie du),",,Anjou,,"paroisse de Parçay, en Anjou."
DT37-21971,"Puits-de-la-Chaise (le lieu du),",,bourg de Saint-Épain,,dans le bourg de Saint-Épain.
DT37-22069,"Puygarreau,",,Poitou,,"en Poitou, élection de Châtellerault."
DT37-22069,"Puygarreau,",élection,Châtellerault,,"en Poitou, élection de Châtellerault."
DT37-22112,"Quatre-Bornes (le lieu des),",,limites de Jaulnay,,"commune de Luzé, sur les limites de Jaulnay."
DT37-22168,"Quinemont (la maison de),",,environs de Bléré,,dans les environs de Bléré.
DT37-22169,"Quinets (le lieu des),",,paroisse du Petit-Pressigny,,paroisse du Petit-Pressigny.
DT37-22172,"Quintaine (moulin de la),",,Saulaie,,"sur le ruisseau de la Saulaie, ou de la Quintaine, commune d’Auzouer."
DT37-22172,"Quintaine (moulin de la),",,Quintaine,,"sur le ruisseau de la Saulaie, ou de la Quintaine, commune d’Auzouer."
DT37-22174,"Quintaine (le lieu de la),",,Valmer,,"commune de Chançay, près du chemin de Vernou à Valmer."
DT37-22192,"Rabaterie (la),",,Poitou,,"paroisse de Sérigny, en Poitou."
DT37-22220,"Rablos (le lieu de),",,Azay,,"commune de Saché, près du chemin d’Azay à Thilouze."
DT37-22233,"Rabusserie (maison de la),",,bourg de Beaumont-la-Ronce,,dans le bourg de Beaumont-la-Ronce.
DT37-22256,"Sainte-Radégonde (fontaine de),",,Saumur,,"commune de Couziers, près de la route de Chinon à Saumur."
DT37-22265,"Raffou (le lieu de),",,Saint-Sépulcre,,"commune du Petit-Pressigny, près du chemin du Saint-Sépulcre à Étableaux."
DT37-22265,"Raffou (le lieu de),",,Étableaux,,"commune du Petit-Pressigny, près du chemin du Saint-Sépulcre à Étableaux."
DT37-22290,"Ragueneaux (le lieu des),",,limites de Montbazon,,"commune de Sorigny, sur les limites de Montbazon."
DT37-22332,"Rainse-Rend (le lieu de la),",,Pinardière,,"commune de Sepmes, près du chemin de Bossee à la Pinardière."
DT37-22375,"Rangées (le bois des),",,Roche,,"commune de Rochecorbon, près du chemin de la Roche à la Chardonnière."
DT37-22375,"Rangées (le bois des),",,Chardonnière,,"commune de Rochecorbon, près du chemin de la Roche à la Chardonnière."
DT37-22404,"Ratière (la),",ferme,Poitou,,"ferme, paroisse d’Orches, en Poitou."
DT37-22409,"Ratte (la),",ferme,bourg de Faye-la-Vineuse,,"ferme, dans le bourg de Faye-la-Vineuse."
DT37-22427,"Raudinerie (le lieu de la),",,bourg de Saunay,,dans le bourg de Saunay « devant le logis de la Cressonnière ».
DT37-22455,"Ré (la croix de),",,Mornière,,"près du chemin de la Mornière, commune de Louans."
DT37-22467,"Rebardières (le lieu des),",,Marigny,,"commune de Pressigny, près du chemin de Marigny, au Bec-des-Deux-Eaux."
DT37-22467,"Rebardières (le lieu des),",,Bec-des-Deux-Eaux,,"commune de Pressigny, près du chemin de Marigny, au Bec-des-Deux-Eaux."
DT37-22474,"Rebours (le lieu de),",,Pouvreau,,"commune du Petit-Pressigny, près du chemin de Pouvreau au gué de Douay."
DT37-22474,"Rebours (le lieu de),",,gué de Douay,,"commune du Petit-Pressigny, près du chemin de Pouvreau au gué de Douay."
DT37-22495,"Recouvert (le lieu de),",,Poitou,,"paroisse de Saint-Christophe, en Poitou."
DT37-22550,"Remet ou Remette (moulin de),",,étang du Louroux,,"sur le ruisseau de l’étang du Louroux, commune de Saint-Baud."
DT37-22552,"Remillon (le lieu de),",,Obterre,,"commune de Saint-Flovier, près du chemin de Saint-Flovier à Obterre."
DT37-22556,"Saint-Remi-sur-Creuse,",,Poitou,,en Poitou.
DT37-22562,"Remulées (le lieu des),",,Pinardière,,"commune de Sepmes, près du chemin de Bossee à la Pinardière."
DT37-22616,"Renaudrie (la),",ancien fief,bourg de Saint-Flovier,,"ancien fief, situé dans le bourg de Saint-Flovier."
DT37-22618,"Renaudries (le lieu des),",,Chapelle,,"commune de Mouzay, près du chemin de Loches à la Chapelle."
DT37-22636,"Renommières (le lieu des),",,Marcilly,,"commune de Marcilly-sur-Vienne, près du chemin de Rilly à Marcilly."
DT37-22644,"Rentes (les),",ferme,Poitou,,"ferme, commune de Coussay-les-Bois, en Poitou."
DT37-22670,"Resnay,",,faubourg de Sassay,,"dans le faubourg de Sassay, paroisse de Bléré."
DT37-22750,"Ribotterie (le lieu de la),",,bourg de la Ferrière,,dans le bourg de la Ferrière.
DT37-22819,"Ridelée (le lieu de la),",,Princé,,"commune d’Auzouer, près du chemin d’Auzouer à Princé."
DT37-22835,"Rien-Vault (le lieu de),",,Roche d’Enchailles,,"commune de Civray-sur-Esves, près du chemin de la Roche d’Enchailles à Civray."
DT37-22835,"Rien-Vault (le lieu de),",,Civray,,"commune de Civray-sur-Esves, près du chemin de la Roche d’Enchailles à Civray."
DT37-22857,"Rigolet (le ruisseau de),",,limites de Chédigny,,"commune de Reignac, sur les limites de Chédigny."
DT37-22870,"Rilly (bois de),",,Celle,,"commune de la Celle-Saint-Avent, près du chemin de la Celle à Seigre."
DT37-22870,"Rilly (bois de),",,Seigre,,"commune de la Celle-Saint-Avent, près du chemin de la Celle à Seigre."
DT37-22880,"Rimonière (le lieu de la),",,bourg de Château-la-Vallière,,dans le bourg de Château-la-Vallière.
