Article,Vedette,Type vedette,Candidat,INSEE,Définition
DT37-15659,"Litres (le lieu des),",,Ormes,,"commune de Marigny, près du chemin de Richelieu aux Ormes."
DT37-15670,"Lizon (le lieu du),",,Bellevue,,"commune de Marçay, près du chemin de Couesme à Bellevue."
DT37-15715,"Loger (le bois),",,Fougereau,,"commune de Charnizay, près du chemin de Pressigny à Fougereau."
DT37-15735,"Loges (le lieu des),",,Marigny,,"commune de Luzé, près du chemin de Luze à Marigny."
DT37-15738,"Loges (le fief des),",,Poitou,,"paroisse d’Orches, en Poitou."
DT37-15742,"Loges (le lieu des),",,Marchais-Ruisseau,,"commune de Sainte-Maure, près du chemin de Sainte-Maure au Marchais-Ruisseau."
DT37-15754,"Loiseau (la fontaine),",,Blinerie,,"commune de Ferrières-Larçon, près du chemin de la Blinerie à Esves-le-Moutier."
DT37-15772,"Long (le),",rivière,côté de Beaumont-la-Ronce,,"rivière, prend sa source du côté de Beaumont-la-Ronce, passe à Villebourg et se jette dans le Loir, au nord de Dissai."
DT37-15772,"Long (le),",rivière,Dissai,,"rivière, prend sa source du côté de Beaumont-la-Ronce, passe à Villebourg et se jette dans le Loir, au nord de Dissai."
DT37-15795,"Longuettes (la fosse des),",,landes du Ruchard,,"dans les landes du Ruchard, commune d’Avon."
DT37-15798,"Lonières (le lieu des),",,Baretterie,,"commune du Grand-Pressigny, près du chemin de la Baretterie à la forêt du Grand-Pressigny."
DT37-15798,"Lonières (le lieu des),",,forêt du Grand-Pressigny,,"commune du Grand-Pressigny, près du chemin de la Baretterie à la forêt du Grand-Pressigny."
DT37-15808,"Lorets (le lieu des),",,Rousselière,,"commune de Saint-Épain, près du chemin de la Rousselière aux Huttières."
DT37-15808,"Lorets (le lieu des),",,Huttières,,"commune de Saint-Épain, près du chemin de la Rousselière aux Huttières."
DT37-15809,"Lorette (chapelle de Notre-Dame-de-),",,Trevaudière,,"à la Trevaudière, commune de Tauxigny."
DT37-15824,"Loualerie (la croix de),",,Lande,,"commune de Bueil, près de Loualerie et du chemin de la Lande à la Corbinière."
DT37-15824,"Loualerie (la croix de),",,Corbinière,,"commune de Bueil, près de Loualerie et du chemin de la Lande à la Corbinière."
DT37-15833,"Louche, ou Ouche (l’),",ancien fief,bourg de Mosnes,,"ancien fief, situé dans le bourg de Mosnes."
DT37-15850,"Louines (le lieu des),",,Vauguérin,,"commune de Crouzilles, près du chemin de Vauguérin à la Sommeraye."
DT37-15850,"Louines (le lieu des),",,Sommeraye,,"commune de Crouzilles, près du chemin de Vauguérin à la Sommeraye."
DT37-15859,"Loulets (le lieu des),",,paroisse du Petit-Pressigny,,paroisse du Petit-Pressigny.
DT37-15865,"Loupendu (le lieu de),",,Boisaubry,,"commune de Luzé, près du chemin de Boisaubry au Montet."
DT37-15865,"Loupendu (le lieu de),",,Montet,,"commune de Luzé, près du chemin de Boisaubry au Montet."
DT37-15875,"Louris (le lieu des),",,Chapelle,,"commune de la Chapelle-Blanche, près du chemin de Bournan à la Chapelle."
DT37-15892,"Louzais (le lieu des),",,Nemant,,"commune de Savigny, près du chemin de Nemant à Savigny."
DT37-15898,"Louzil (le fief de),",,Poitou,,"paroisse de Sossay, en Poitou."
DT37-15904,"Luains (le fief de),",,Poitou,,"paroisse de Saint-Christophe-sous-Faye, en Poitou."
DT37-15955,"Lutinière (fontaine de la),",,Grand-Pressigny,,"commune du Petit-Pressigny, près du chemin du Grand-Pressigny au Petit-Pressigny."
DT37-15955,"Lutinière (fontaine de la),",,Petit-Pressigny,,"commune du Petit-Pressigny, près du chemin du Grand-Pressigny au Petit-Pressigny."
DT37-15973,"Macenillon (le lieu de),",,Chaperonnière,,"commune de Ligré, près du chemin de Ligre à la Chaperonnière."
DT37-15988,"le Cimetière,",,bourg de Rouziers,,dans le bourg de Rouziers.
DT37-15991,"Madeleine (bruyères de la),",,Lureuil,,"commune de Bossay, près du chemin de Bossay à Lureuil."
DT37-15992,"Madeleine (la),",ferme,bourg de Faye-la-Vineuse,,"ferme, dans le bourg de Faye-la-Vineuse."
DT37-15996,"Madeleine (la),",ferme,faubourg dit le Bourg-Neuf,,"ferme, commune de Preuilly, dans le faubourg dit le Bourg-Neuf."
DT37-16000,"Madeleine (île de la),",,Loire,,dans la Loire.
DT37-16014,"Mafrière (la),",ancienne dépendance,terre de Crissé,,ancienne dépendance de la terre de Crissé.
DT37-16016,"Mageries (le lieu des),",,Marigny,,"commune de Jaulnay, près du chemin de Richelieu à Marigny."
DT37-16104,"Maison-Brûlée (le lieu de la),",,landes du Ruchard,,"dans les landes du Ruchard, commune de Cravant."
DT37-16132,"Maison-du-Bois (le lieu de la),",,Faye,,"commune de Faye, près du chemin de Faye à Braye."
DT37-16132,"Maison-du-Bois (le lieu de la),",,Braye,,"commune de Faye, près du chemin de Faye à Braye."
DT37-16194,"Maison-Noire (le lieu de la),",,Bête,,"commune de Vou, près du chemin de la Bête."
DT37-16291,"Malaré (le lieu de),",,Vallée-de-Mesvres,,"commune de Civray-sur-Cher, près du chemin de la Vallée-de-Mesvres aux Touches."
DT37-16291,"Malaré (le lieu de),",,Touches,,"commune de Civray-sur-Cher, près du chemin de la Vallée-de-Mesvres aux Touches."
DT37-16293,Mala Paria,,paroisse du Grand-Pressigny,,paroisse du Grand-Pressigny.
DT37-16294,Mala Spina,,paroisse du Grand-Pressigny,,paroisse du Grand-Pressigny.
DT37-16300,Malavilla,,environs de Langeais,,dans les environs de Langeais.
DT37-16318,"Malgagne (le lieu de),",,Termellières,,"commune de la Chapelle-Blanche, près du chemin des Termellières aux Jumeaux."
DT37-16318,"Malgagne (le lieu de),",,Jumeaux,,"commune de la Chapelle-Blanche, près du chemin des Termellières aux Jumeaux."
DT37-16326,"Malheur (la fontaine du),",,Langlée,,"commune de Champigny, près du chemin de Langlée à la Barrière."
DT37-16326,"Malheur (la fontaine du),",,Barrière,,"commune de Champigny, près du chemin de Langlée à la Barrière."
DT37-16359,"Malnosses (le lieu des),",,Ferrières,,"commune de Ferrières-Larçon, près du chemin de Ligueil à Ferrières."
DT37-16373,"Malpogne (le lieu de),",,forêt du Grand-Pressigny,,dans la forêt du Grand-Pressigny.
DT37-16378,"Maltache (le lieu de),",,bourg d’Artannes,,dans le bourg d’Artannes.
DT37-16407,"Manège (le lieu du),",,Loges,,"commune de Chinon, près du chemin de Chinon aux Loges."
DT37-16437,"Mantonnelle (étang de la),",,paroisse du Bridoré,,paroisse du Bridoré.
DT37-16450,"Marais (la maison du),",,bourg de la Ferrière,,dans le bourg de la Ferrière.
DT37-16514,"Marchais-au-Loup (le lieu du),",,Celle-Guenand,,"commune de Charnizay, près du chemin de la Celle-Guenand à Saint-Flovier."
DT37-16521,"Marchais-Courant (le lieu du),",,Cirandes,,"commune d’Yzeures, près du chemin de Cirandes à Marigny."
DT37-16521,"Marchais-Courant (le lieu du),",,Marigny,,"commune d’Yzeures, près du chemin de Cirandes à Marigny."
DT37-16523,"Marchais-Crochet (le lieu du),",,Bois-Turmeau,,"commune de Cussay, près du chemin du Bois-Turmeau à la Cigogne."
DT37-16531,"Marchais-des-Canards (le lieu du),",,limites de Saint-Branchs,,"commune de Louans, sur les limites de Saint-Branchs."
DT37-16533,"Marchais-des-Petits-Chemins (le lieu du),",,landes du Ruchard,,"dans les landes du Ruchard, commune d’Avon."
DT37-16542,"Marchais-Poulinier (le lieu du),",,Chaîne-Soulière,,"commune de Manthelan, près du chemin de Manthelan à la Chaîne-Soulière."
DT37-16590,"Marcion (le lieu du),",,landes du Ruchard,,"dans les landes du Ruchard, commune d’Avon."
DT37-16631,"Margats (le lieu des),",,Saint-Étienne,,"commune de Mazières, près du chemin de Saint-Étienne à la Brosse."
DT37-16631,"Margats (le lieu des),",,Brosse,,"commune de Mazières, près du chemin de Saint-Étienne à la Brosse."
DT37-16644,"Mariantras (le lieu de),",,Girardières,,"commune d’Esves-le-Moutier, près du chemin de Ligueil aux Girardières."
DT37-16652,"Sainte-Marie-Madeleine (île),",,paroisse Saint-Pierre-des-Corps,,"dans la Loire, paroisse Saint-Pierre-des-Corps, en face de Saint-Loup."
DT37-16652,"Sainte-Marie-Madeleine (île),",,en face de Saint-Loup,,"dans la Loire, paroisse Saint-Pierre-des-Corps, en face de Saint-Loup."
DT37-16700,"Marmoutier (île de),",,Loire,,dans la Loire.
DT37-16757,Marriaco,,environs de l’Ile-Bouchard,,situé dans les environs de l’Ile-Bouchard.
DT37-16765,"Marsandron (le lieu de),",,paroisse du Fau,,paroisse du Fau (Reignac).
DT37-16783,"Marteaux (le bois des),",,Felonnière,,"commune de Thilouze, près du chemin de la Felonnière à la Villière."
DT37-16783,"Marteaux (le bois des),",,Villière,,"commune de Thilouze, près du chemin de la Felonnière à la Villière."
DT37-16800,"Martin (le fief),",,Véron,,dans le Véron.
DT37-16806,"Saint-Martin (la fontaine),",,Pré-Pineau,,"située au Pré-Pineau, près de Girodet, commune d’Esves-le-Moutier."
DT37-16881,"Masnières (le lieu des),",,Meslay,,"commune de Parçay-Meslay, près du chemin de Tours à Meslay."
DT37-16899,"Marteaux (le lieu des),",,limites de Ballan,,"commune de Druye, sur les limites de Ballan."
DT37-16912,"Maubec (abbaye de),",,Berry,,en Berry.
DT37-16919,"Mauclerc (la Croix),",,Échallerie,,"commune de Sorigny, près du chemin de l’Échallerie à Cesnay."
DT37-16919,"Mauclerc (la Croix),",,Cesnay,,"commune de Sorigny, près du chemin de l’Échallerie à Cesnay."
DT37-16943,"Mauguinière (croix de),",,vallée de Raye,,"commune de Chançay, près du chemin de Noizay à la vallée de Raye."
DT37-16978,"Maupas (le lieu de),",,Basse-Mansellière,,"commune de Nouâtre, près du chemin de Sainte-Maure à la Basse-Mansellière."
DT37-17001,"Maurice (la Fosse),",,Fosse-Besse,,"commune de Civray-sur-Cher, près du chemin de Fosse-Besse, aux Basses-Fougères."
DT37-17001,"Maurice (la Fosse),",,Basses-Fougères,,"commune de Civray-sur-Cher, près du chemin de Fosse-Besse, aux Basses-Fougères."
DT37-17003,"Saint-Maurice (bois de),",,limites de Sainte-Catherine-de-Fierbois,,"au sud de la commune de Sorigny, sur les limites de Sainte-Catherine-de-Fierbois."
DT37-17091,"Medards (le lieu des),",,Maillé,,"commune de Maillé, près du chemin de Maillé au village des Champs."
DT37-17097,"Mée (le lieu du),",,paroisse du Petit-Pressigny,,paroisse du Petit-Pressigny.
DT37-17114,"Melinay (le lieu de),",,près Loches,,"paroisse de Beaulieu, près Loches."
DT37-17128,"Menage (le),",vaste étendue de terrain,Bordes,,"vaste étendue de terrain situé entre les Bordes et la Fosse-Rouge, commune de Saint-Antoine-du-Rocher."
DT37-17128,"Menage (le),",vaste étendue de terrain,Fosse-Rouge,,"vaste étendue de terrain situé entre les Bordes et la Fosse-Rouge, commune de Saint-Antoine-du-Rocher."
DT37-17181,"Méon (la croix),",,limites de Chenu,,"commune de Brèches, sur les limites de Chenu."
DT37-17190,"Mercelots (bois des),",,Sainte-Julitte,,"commune de Saint-Senoch, près du chemin de Sainte-Julitte à Loches."
DT37-17196,"Merci-Dieu (abbaye de la),",,Poitou,,en Poitou.
DT37-17338,"Metière (le lieu de la),",,Port-de-Rassay,,"commune de Saint-Germain-sur-Vienne, près du chemin de Couziers au Port-de-Rassay."
DT37-17362,"Mézières-en-Brenne,",chef-lieu de canton,arrondissement du Blanc,,"chef-lieu de canton de l’arrondissement du Blanc (Indre),"
DT37-17440,"Millerie (le lieu de la),",,Chaîne-Soulière,,"commune de Manthelan, près du chemin de Manthelan à Chaîne-Soulière."
DT37-17446,"Millet (le ruisseau de),",,étang de la Douce,,"prend sa source dans l’étang de la Douce, commune de Continvoir, et se jette dans le Changeon, au lieu dit la Mulottière."
DT37-17446,"Millet (le ruisseau de),",,Mulottière,,"prend sa source dans l’étang de la Douce, commune de Continvoir, et se jette dans le Changeon, au lieu dit la Mulottière."
DT37-17475,"Mine-de-Grandmont (le lieu de la),",,paroisse du Grand-Pressigny,,paroisse du Grand-Pressigny.
DT37-17492,"Minées (le lieu des),",,Couarde,,"commune de Sorigny, près du chemin de la Couarde à l’Oclinière."
DT37-17492,"Minées (le lieu des),",,Oclinière,,"commune de Sorigny, près du chemin de la Couarde à l’Oclinière."
DT37-17498,"Mineraux (le lieu des),",,Germain,,"près du chemin de Saint-Flovier à Germain, commune de Saint-Flovier."
DT37-17512,"Miniéres (le lieu des),",,Sammarçolle,,"commune de Marçay, canton de Richelieu, près du chemin de Sammarçolle à Chinon."
DT37-17515,"Miniers (le lieu des),",,Azay,,"commune de Vallères, près du chemin de Villandry à Azay."
DT37-17534,"Misère (le lieu de),",,Tournon,,"commune de Saint-Pierre-de-Tournon, près du chemin de Tournon à Pouille."
DT37-17538,"Mission (la croix de),",,Azay,,"près du château de Charnizay, sur le chemin de Charnizay à Azay."
DT37-17591,"Moisinière (la), ou Moysinière,",,Anjou,,"paroisse d’Auverse, en Anjou."
DT37-17614,"Molivault (la croix de),",,Chemillé,,près du chemin de Saint-Christophe à Chemillé.
DT37-17615,"Mollette (la croix),",,Vitray,,"commune de Loché, près du chemin de Vitray à Villedomain."
DT37-17630,"Monceaux (le lieu de),",,Faroire,,"commune de Thilouze, près du chemin de Thilouze à la Faroire."
DT37-17634,"Monclair (la fontaine de),",,Giberdière,,"commune de Vallères, près du chemin de Valleres à la Giberdière."
DT37-17643,"Mondion,",,Poitou,,en Poitou.
DT37-17674,"Monpas (le lieu de),",,Haye,,"commune de la Guerche, près du chemin de la Haye à Barrou."
DT37-17756,"Montflière (le lieu de la),",ferme,Grands-Ormeaux,,"ferme, commune de Saint-Michel-sur-Loire, près du chemin des Grands-Ormeaux à Saint-Michel."
DT37-17756,"Montflière (le lieu de la),",ferme,Saint-Michel,,"ferme, commune de Saint-Michel-sur-Loire, près du chemin des Grands-Ormeaux à Saint-Michel."
DT37-17763,"Mont-Frelon (le lieu de),",,Bulardière,,"commune de Gizeux, près du chemin de la Bulardière à Butonneau."
DT37-17763,"Mont-Frelon (le lieu de),",,Butonneau,,"commune de Gizeux, près du chemin de la Bulardière à Butonneau."
DT37-17797,"Mont-Jacques (le lieu de),",,Noyers,,"commune de Nouâtre, près du chemin de Noyers aux Maisons-Rouges."
DT37-17797,"Mont-Jacques (le lieu de),",,Maisons-Rouges,,"commune de Nouâtre, près du chemin de Noyers aux Maisons-Rouges."
DT37-17819,"Montpertuis (le lieu de),",,Neuillé,,"commune de Nouâtre, près du chemin de Nouatre à Neuillé."
DT37-17905,"Moreaux (les bois),",,Bréchottière,,"commune de Louans, près du chemin de Sainte-Maure à la Bréchottière."
DT37-17932,"Morennières (le lieu des),",,Pictière,,"commune de Sazilly, près du chemin de la Pictière au carroi Tormeau."
DT37-17932,"Morennières (le lieu des),",,carroi Tormeau,,"commune de Sazilly, près du chemin de la Pictière au carroi Tormeau."
DT37-17943,"Moribot (le lieu de),",,Carroi-du-Saule,,"commune de Ligré, près du chemin du Carroi-du-Saule à Riviere."
DT37-17974,"Morilles (le lieu des),",,Seguinière,,"commune de Louans, près du chemin de la Seguinière à la Basse-Cour."
DT37-17974,"Morilles (le lieu des),",,Basse-Cour,,"commune de Louans, près du chemin de la Seguinière à la Basse-Cour."
DT37-17988,"Morin (la croix),",,coteau de Seuilly,,"commune de Seuilly, près du chemin de Lerne au coteau de Seuilly."
DT37-18071,"Mortier-Buissonnet (le lieu du),",,Chaloisière,,"commune de Saint-Michel-sur-Loire, près du chemin de la Chaloisière à Commandin."
DT37-18071,"Mortier-Buissonnet (le lieu du),",,Commandin,,"commune de Saint-Michel-sur-Loire, près du chemin de la Chaloisière à Commandin."
DT37-18074,"Mortier-Clair (le lieu du),",,Pont-Boutard,,"paroisse de Saint-Michel-sur-Loire, près du chemin de Pont-Boutard à Saint-Michel."
DT37-18074,"Mortier-Clair (le lieu du),",,Saint-Michel,,"paroisse de Saint-Michel-sur-Loire, près du chemin de Pont-Boutard à Saint-Michel."
DT37-18078,"Mortier-d’Auchamp (le lieu du),",,Essarts,,"commune de Restigné, près du chemin de Restigne aux Essarts."
DT37-18081,"Mortier-de-la-Provence (le lieu du),",,Essarts,,"commune des Essarts, près du chemin de Restigne aux Essarts."
DT37-18088,"Mortier-des-Landes (le lieu du),",,Fortinerie,,"commune de Gizeux, près du chemin de la Fortinerie à Rille."
DT37-18097,"Mortier-Hubert (le lieu du),",,Saint-Étienne,,"commune de Mazières, près du chemin de Saint-Étienne à la Brosse."
DT37-18097,"Mortier-Hubert (le lieu du),",,Brosse,,"commune de Mazières, près du chemin de Saint-Étienne à la Brosse."
DT37-18123,"Mortiers (le lieu des),",,Perrée-aux-Naux,,"commune de Lignières, près du chemin de la Perrée-aux-Naux à Azay."
DT37-18123,"Mortiers (le lieu des),",,Azay,,"commune de Lignières, près du chemin de la Perrée-aux-Naux à Azay."
DT37-18128,"Mortiers-au-Chanvre (le lieu des),",,Saint-Étienne,,"commune de Mazières, près du chemin de Clere à Saint-Étienne."
DT37-18156,"Motté (le lieu de),",,Loutière,,"commune d’Avon, près du chemin de la Loutière à la Touche."
DT37-18156,"Motté (le lieu de),",,Touche,,"commune d’Avon, près du chemin de la Loutière à la Touche."
DT37-18161,"Motte (le lieu de la),",,Sainte-Catherine,,"commune de Bossée, près du chemin de Bossee à Sainte-Catherine."
DT37-18200,"Motte-Aufray (le lieu de la),",,Port-Boulet,,"commune de Savigny, près du chemin de Port-Boulet à Savigny."
DT37-18213,"Motte-Mazières (le lieu de la),",,Touches,,"commune de Mazières, près du chemin des Touches au Ponceau."
DT37-18213,"Motte-Mazières (le lieu de la),",,Ponceau,,"commune de Mazières, près du chemin des Touches au Ponceau."
DT37-18215,"Motte-Ronde (le lieu de la),",,Chavannes,,"commune de Benais, près du chemin de Chavannes à Grandchamp."
DT37-18215,"Motte-Ronde (le lieu de la),",,Grandchamp,,"commune de Benais, près du chemin de Chavannes à Grandchamp."
DT37-18226,"Mottes (le lieu des),",,Nantes,,"commune de Chouzé-sur-Loire, près de la route de Nantes à Tours."
DT37-18229,"Mottes (le lieu des),",,Folie,,"commune de Saché, près du chemin de la Folie à Thilouze."
DT37-18275,"Moulin-à-l’Eau (le), ou le Moulin-Blanc, autrefois le Moulin-Gilbert,",,paroisse du Sablon,,"paroisse du Sablon, maintenant commune de Chaveignes."
DT37-18298,"Moulin-à-Vent (le lieu du),",,Rauderies,,"commune de Louans, près du chemin des Rauderies à Louans."
DT37-18378,"Moulin-du-Puits (la croix du),",,Villienne,,"commune de Loché, près du chemin de Loche à Villienne."
DT37-18430,"Moulin-Neuf (la croix du),",,Saumur,,"commune de Saint-Nicolas-de-Bourgueil, près de la route de Saumur à Bourgueil."
DT37-18479,"Moulins-Devant (le lieu des),",,Cour,,"commune de Saint-Germain-sur-Vienne, près du chemin de la Cour à la Chaussée."
DT37-18479,"Moulins-Devant (le lieu des),",,Chaussée,,"commune de Saint-Germain-sur-Vienne, près du chemin de la Cour à la Chaussée."
DT37-18507,"Mousseaux,",ferme,Poitou,,"ferme, commune de Poizay-le-Joly, en Poitou."
DT37-18518,"Mouton (la maison du),",,Pont-de-la-Motte,,"au Pont-de-la-Motte, commune de Saint-Cyr."
DT37-18520,"Mouton-de-Cluis (le),",ancien fief,baronnie de la Haye,,"ancien fief, relevant de la baronnie de la Haye, à foi et hommage lige."
DT37-18533,"Mouzé (le),",,Pertuis,,"commune d’Orbigny, sur le chemin de Blere au Pertuis."
DT37-18558,"Munet (le fief de),",,Anjou,,"paroisse de Distré, en Anjou."
DT37-18571,"Murger (le lieu de),",,étang de Jupilles,,"commune de Mazières, près du ruisseau de l’étang de Jupilles."
DT37-18598,"Nagueries (le lieu des),",,Poteau-Delié,,"commune de Saint-Senoch, près du chemin du Poteau-Delié à Loches."
DT37-18629,"Nauderies (les),",ferme,quartier du Morier,,"ferme, commune de Tours, dans le quartier du Morier."
DT37-18650,"Navelière (la),",,Poitou,,"paroisse de Coussay-les-Bois, en Poitou."
DT37-18654,"Navines (le lieu des),",,Faye,,"commune de Braye-sous-Faye, près du chemin de Faye à Richelieu."
DT37-18666,"Négron (ruisseau de),",,Boisrogues,,"vient de Boisrogues, en Poitou, forme la limite entre les communes de Cinais et de la Roche-Clermault, traverse les prairies de Clan et se jette dans la Vienne, aux Maisons-de-l’Arche, commune de Cinais."
DT37-18666,"Négron (ruisseau de),",,Poitou,,"vient de Boisrogues, en Poitou, forme la limite entre les communes de Cinais et de la Roche-Clermault, traverse les prairies de Clan et se jette dans la Vienne, aux Maisons-de-l’Arche, commune de Cinais."
DT37-18666,"Négron (ruisseau de),",,prairies de Clan,,"vient de Boisrogues, en Poitou, forme la limite entre les communes de Cinais et de la Roche-Clermault, traverse les prairies de Clan et se jette dans la Vienne, aux Maisons-de-l’Arche, commune de Cinais."
DT37-18666,"Négron (ruisseau de),",,Maisons-de-l’Arche,,"vient de Boisrogues, en Poitou, forme la limite entre les communes de Cinais et de la Roche-Clermault, traverse les prairies de Clan et se jette dans la Vienne, aux Maisons-de-l’Arche, commune de Cinais."
DT37-18683,"Neuillé-le-Lierre,",commune,canton ,,"commune du canton 373de Vouvray, arrondissement de Tours,"
DT37-18708,"Niche-au-Loup (le lieu de la),",,Pont-Boutard,,"commune d’Ingrandes, près du chemin de Restigne à Pont-Boutard."
DT37-18709,"Saint-Nicolas (la croix de),",,Montoire,,"commune de la Ferrière, près du chemin de Tours à Montoire."
DT37-18718,"Nid-du-Chouan (le lieu du),",,Azay,,"commune de Saint-Benoît, près de la route de Chinon à Azay."
DT37-18731,"Nival (le lieu de),",,Tiraudière,,"commune de Saint-Germain-sur-Vienne, près du chemin de la Tiraudière au Petit-Thouars."
DT37-18731,"Nival (le lieu de),",,Petit-Thouars,,"commune de Saint-Germain-sur-Vienne, près du chemin de la Tiraudière au Petit-Thouars."
DT37-18741,"Nizeraille, ou Nizereille,",hameau,commune ,,"hameau, commune 385de Cussay,"
DT37-18777,"Noirs (le lieu des),",,Carroi,,"commune du Louroux, près du chemin du Carroi à Bossee."
DT37-18781,"Noisas (le lieu des),",,Marnay,,"commune de Lignières, près du chemin de Valleres à Marnay."
DT37-18794,"Noraie (le lieu de la),",,paroisse du Petit-Pressigny,,"paroisse du Petit-Pressigny, près du bourg."
DT37-18822,"Noue (la),",ferme,Anjou,,"ferme, paroisse de Meigné, en Anjou."
DT37-18840,"Noue-Derouin (le lieu de la),",,Baigneux,,"commune de Civray-sur-Cher, près du chemin de Baigneux au Tremble."
DT37-18840,"Noue-Derouin (le lieu de la),",,Tremble,,"commune de Civray-sur-Cher, près du chemin de Baigneux au Tremble."
DT37-18842,"Noue-du-Guignier (le lieu de la),",,landes du Ruchard,,"dans les landes du Ruchard, commune d’Avon."
DT37-18851,"Noues (les Grandes),",fosses,landes du Ruchard,,"fosses situées dans les landes du Ruchard, commune d’Avon."
DT37-18857,"Noues-Brunettes (le lieu des),",,Vallée de la Carte,,"commune de Monnaie, près du chemin de la Vallée de la Carte à Reugny."
DT37-18864,"Nouettes (le lieu des),",,Tremblères,,"commune de Villeloin-Coulangé, près du chemin des Tremblères à la Touche."
DT37-18864,"Nouettes (le lieu des),",,Touche,,"commune de Villeloin-Coulangé, près du chemin des Tremblères à la Touche."
DT37-18875,"Nourisson (le lieu de),",,Chevrette,,"commune de Saint-Nicolas-de-Bourgueil, près du chemin de Chevrette à Courleon."
DT37-18879,"Nouzillet (le bois de),",,moulin de Cutaison,,"commune de Mazières, près du ruisseau du Breuil et du moulin de Cutaison."
DT37-18887,"Noyer-de-Saint-Roch (le lieu du),",,Gué,,"commune de Saint-Épain, près du chemin du Gué à la Porte-Neuve."
DT37-18887,"Noyer-de-Saint-Roch (le lieu du),",,Porte-Neuve,,"commune de Saint-Épain, près du chemin du Gué à la Porte-Neuve."
DT37-18897,"Nuitances (le bois des),",,Rerleroux,,"commune de Dolus, près du chemin de Dolus à Rerleroux."
DT37-18918,"Oiré,",,Poitou,,"en Poitou, près de Châtellerault."
DT37-18951,"Olivet (le ruisseau d’),",,Pont-de-Pierre,,"vient de la forêt de Brouard, passe dans la commune de Beaumont-Village, puis dans celle de Chemille-sur-Indrois, où il se jette dans l’Indrois au lieu appelé Pont-de-Pierre."
DT37-18963,"Onze-Liards (le lieu des),",,Galvaudière,,"commune de Chinon, près du chemin de Chinon à la Galvaudière."
DT37-18974,"Orches,",,Poitou,,"en Poitou, prieuré."
DT37-18983,"Orfonds (la fontaine d’),",,Rétrie,,"commune de Veigné, près du chemin de Montbazon à la Rétrie."
DT37-19020,"Ormeau-Bonzy (le lieu de l’),",,Menardière,,"commune de Theneuil, près du chemin de la Menardière à l’Ile-Bouchard."
DT37-19028,"Ormeau-Ferré (le lieu de l’),",,Chenevelles,,"423Pouzaycommune de , près du chemin de Chenevelles à Soulangé."
DT37-19028,"Ormeau-Ferré (le lieu de l’),",,Soulangé,,"423Pouzaycommune de , près du chemin de Chenevelles à Soulangé."
DT37-19030,"Ormeau-Maillard (le lieu de l’),",,Faye,,"commune de Faye-la-Vineuse, près du chemin de Saint-Christophe à Faye."
DT37-19050,"Ormes (les), Ormes-Saint-Martin,",,Poitou,,en Poitou.
DT37-19073,"Ouche-Baudichon (le lieu de l’),",,Sainte-Julitte,,"commune de la Celle-Guenand, près du chemin de la Haye-Descartes à Sainte-Julitte."
DT37-19076,"Ouche-Bonnichon (le lieu de l’),",,commune ,,"commune 426de Betz, près du chemin de la Haye à Saint-Flovier."
DT37-19076,"Ouche-Bonnichon (le lieu de l’),",,Haye,,"commune 426de Betz, près du chemin de la Haye à Saint-Flovier."
DT37-19084,"Ouche-de-l’Étang (le lieu de l’), ou le Verger,",,Celle-Guenand,,"commune de Betz, près du chemin de la Celle-Guenand à Loches."
DT37-19131,"Ouches (les),",ferme,Poitou,,"paroisse de Poizay-le-Joly, en Poitou."
DT37-19133,"Ouches-Cattai (le lieu des),",,paroisse ,,paroisse 428de la Chapelle-sur-Loire.
DT37-19141,"Ouillères (le lieu des),",,Paviers,,"commune de Trogues, près du chemin de Paviers à Saint-Epain."
DT37-19192,"Pain-Béni (le lieu du),",,Saumur,,"près de la route de Saumur à Bourges, commune de Manthelan."
DT37-19192,"Pain-Béni (le lieu du),",,Bourges,,"près de la route de Saumur à Bourges, commune de Manthelan."
